{
  "schemaVersion": "autoloop.review-verdict/v1",
  "jobId": "autoloop-pgma1.g0001",
  "lineageId": "autoloop-pgma1",
  "generation": 1,
  "candidateIdentity": {
    "changedTreeIdentity": "62a3cc68dc3b4d71563803956eebd14808cb1493be5cdadab1c184bfb6df0ae6",
    "patchSha256": "af9fa27c179ed87443e3d1d03933d0f384230015eb6244b569604c188e7a8b03",
    "currentHead": "7e04f4e75f1ddb261d4fa55167c655e5f54069d9",
    "baseHead": "78facaff2200ae5176a74b8deef5f612220d7cde",
    "repository": "xonogesrs/autoloop",
    "branch": "governance/push-draft-gate-authority-migration"
  },
  "specIdentity": {
    "specId": "autoloop-pgma1",
    "specDigest": "7c02bd3a545c88986843936b2c4888cfcca0fc5ae62a3a76c2259cac2972e1ba"
  },
  "findingsDigest": "7029bf093081e2746599d38a0133f1bbd457559958fef099cd2d1ca1bc068c94",
  "reviewerIdentity": "pgma1-independent-reviewer",
  "verdict": "PASS",
  "summary": "PGMA1 migration approved after REPAIR resolution; gates verified 27/27 + e2e 17/17; suite 418 pass / 5 pre-existing env failures (identical to baseline 78facaf).",
  "recommendedNextAction": "External review of PGMA1 closeout bundle; then promotion through its own lineage (review-job ACCEPTED + delivery PASS + new canonical gates).",
  "createdAt": "2026-08-16T10:01:42.404Z"
}
