{
  "schemaVersion": "autoloop.review-verdict/v1",
  "jobId": "autoloop-auth1.g0002",
  "lineageId": "autoloop-auth1",
  "generation": 2,
  "candidateIdentity": {
    "changedTreeIdentity": "83480174bd354bba9c28afe62bd7e05b5dcd37d6d29c041506097e3e68f2317c",
    "patchSha256": "d2dd770001f455e6c4f55b161dc928ae1a91f91a918436f471142f3377fb9c3b",
    "currentHead": "e1ecb45fb69778a4d85f0b968ed6847008d029ce",
    "baseHead": "a06124c8d919757c1a6371daaae89ab14546c9ef",
    "repository": "xonogesrs/autoloop",
    "branch": "governance/auth1-production-retrieval-authority"
  },
  "specIdentity": {
    "specId": "autoloop-auth1",
    "specDigest": "7e17e5a909740db5fa234378f419120b7e019ed6bc6453f2408e3ae52c8381dd"
  },
  "findingsDigest": "6e08b91c7f10b897d8b201854c92d829182eb80f789048911fb28295b14475e1",
  "reviewerIdentity": "controller",
  "verdict": "PASS",
  "summary": "AUTH1 terminal acceptance (g0002): candidate identity 83480174 bound to final HEAD e1ecb45f.",
  "recommendedNextAction": "Deliver canonically; TC1 auto-rollover to Archive.",
  "createdAt": "2026-08-16T08:00:28.847Z"
}
